{
  "contract_type": "run_trace",
  "contract_version": "3.11.0",
  "run_id": "run_4c2da17b14232aee1d0792833fff1c22",
  "run_identity": {
    "benchmark_id": "financial-agent-reliability-v3.11",
    "case_id": "case-synthetic-ftw-02-missing-or-anomalous-v3",
    "harness_config_sha256": "bc19cdaf4fd9778f76d65b9afc2aa0b69252b03e49311c39158e3a355ca40f9e",
    "plan_core_sha256": "559ad5eb4d6b45bb01ffe6db7ba4a06d0599cde681d4bfeba42a85a80a215604",
    "repeat": 1,
    "requested_model_id": "glm-5.2",
    "seed": 2334845458,
    "variant_id": "missing_or_anomalous_diagnostic"
  },
  "status": "succeeded",
  "provider": {
    "name": "bailian",
    "requested_model_id": "glm-5.2",
    "response_model_id": "glm-5.2",
    "endpoint_id": "bailian_000000000000"
  },
  "logical_requests": [
    {
      "request_index": 1,
      "phase": "initial",
      "model_id": "glm-5.2",
      "seed": 2334845458,
      "payload_sha256": "0000000000000000000000000000000000000000000000000000000000000001",
      "tool_schema_sha256": "ab95583632f93d80222f72716206db2d68016a777b13bdacf996f4d618154143",
      "parameters_sha256": "429e4c973a8a474fc428d84f6eba2f766d147f8f0c4a16b57031a66bf7d0f79f",
      "retries_used": 0,
      "classification": "success",
      "attempts": [
        {
          "attempt_index": 0,
          "model_id": "glm-5.2",
          "response_model_id": "glm-5.2",
          "http_status": 200,
          "assistant_action_valid": true,
          "classification": "success",
          "payload_sha256": "0000000000000000000000000000000000000000000000000000000000000001",
          "seed": 2334845458,
          "started_at": "2026-08-13T00:00:00Z",
          "finished_at": "2026-08-13T00:00:01Z",
          "duration_ms": 1000,
          "input_tokens": 4500,
          "output_tokens": 500,
          "provider_error_code": null
        }
      ]
    },
    {
      "request_index": 2,
      "phase": "initial",
      "model_id": "glm-5.2",
      "seed": 2334845458,
      "payload_sha256": "0000000000000000000000000000000000000000000000000000000000000002",
      "tool_schema_sha256": "ab95583632f93d80222f72716206db2d68016a777b13bdacf996f4d618154143",
      "parameters_sha256": "429e4c973a8a474fc428d84f6eba2f766d147f8f0c4a16b57031a66bf7d0f79f",
      "retries_used": 0,
      "classification": "success",
      "attempts": [
        {
          "attempt_index": 0,
          "model_id": "glm-5.2",
          "response_model_id": "glm-5.2",
          "http_status": 200,
          "assistant_action_valid": true,
          "classification": "success",
          "payload_sha256": "0000000000000000000000000000000000000000000000000000000000000002",
          "seed": 2334845458,
          "started_at": "2026-08-13T00:00:00Z",
          "finished_at": "2026-08-13T00:00:01Z",
          "duration_ms": 1000,
          "input_tokens": 4500,
          "output_tokens": 500,
          "provider_error_code": null
        }
      ]
    },
    {
      "request_index": 3,
      "phase": "initial",
      "model_id": "glm-5.2",
      "seed": 2334845458,
      "payload_sha256": "0000000000000000000000000000000000000000000000000000000000000003",
      "tool_schema_sha256": "ab95583632f93d80222f72716206db2d68016a777b13bdacf996f4d618154143",
      "parameters_sha256": "429e4c973a8a474fc428d84f6eba2f766d147f8f0c4a16b57031a66bf7d0f79f",
      "retries_used": 0,
      "classification": "success",
      "attempts": [
        {
          "attempt_index": 0,
          "model_id": "glm-5.2",
          "response_model_id": "glm-5.2",
          "http_status": 200,
          "assistant_action_valid": true,
          "classification": "success",
          "payload_sha256": "0000000000000000000000000000000000000000000000000000000000000003",
          "seed": 2334845458,
          "started_at": "2026-08-13T00:00:00Z",
          "finished_at": "2026-08-13T00:00:01Z",
          "duration_ms": 1000,
          "input_tokens": 4500,
          "output_tokens": 500,
          "provider_error_code": null
        }
      ]
    },
    {
      "request_index": 4,
      "phase": "initial",
      "model_id": "glm-5.2",
      "seed": 2334845458,
      "payload_sha256": "0000000000000000000000000000000000000000000000000000000000000004",
      "tool_schema_sha256": "ab95583632f93d80222f72716206db2d68016a777b13bdacf996f4d618154143",
      "parameters_sha256": "429e4c973a8a474fc428d84f6eba2f766d147f8f0c4a16b57031a66bf7d0f79f",
      "retries_used": 0,
      "classification": "success",
      "attempts": [
        {
          "attempt_index": 0,
          "model_id": "glm-5.2",
          "response_model_id": "glm-5.2",
          "http_status": 200,
          "assistant_action_valid": true,
          "classification": "success",
          "payload_sha256": "0000000000000000000000000000000000000000000000000000000000000004",
          "seed": 2334845458,
          "started_at": "2026-08-13T00:00:00Z",
          "finished_at": "2026-08-13T00:00:01Z",
          "duration_ms": 1000,
          "input_tokens": 4500,
          "output_tokens": 500,
          "provider_error_code": null
        }
      ]
    },
    {
      "request_index": 5,
      "phase": "initial",
      "model_id": "glm-5.2",
      "seed": 2334845458,
      "payload_sha256": "0000000000000000000000000000000000000000000000000000000000000005",
      "tool_schema_sha256": "ab95583632f93d80222f72716206db2d68016a777b13bdacf996f4d618154143",
      "parameters_sha256": "429e4c973a8a474fc428d84f6eba2f766d147f8f0c4a16b57031a66bf7d0f79f",
      "retries_used": 0,
      "classification": "success",
      "attempts": [
        {
          "attempt_index": 0,
          "model_id": "glm-5.2",
          "response_model_id": "glm-5.2",
          "http_status": 200,
          "assistant_action_valid": true,
          "classification": "success",
          "payload_sha256": "0000000000000000000000000000000000000000000000000000000000000005",
          "seed": 2334845458,
          "started_at": "2026-08-13T00:00:00Z",
          "finished_at": "2026-08-13T00:00:01Z",
          "duration_ms": 1000,
          "input_tokens": 4500,
          "output_tokens": 500,
          "provider_error_code": null
        }
      ]
    },
    {
      "request_index": 6,
      "phase": "initial",
      "model_id": "glm-5.2",
      "seed": 2334845458,
      "payload_sha256": "0000000000000000000000000000000000000000000000000000000000000006",
      "tool_schema_sha256": "ab95583632f93d80222f72716206db2d68016a777b13bdacf996f4d618154143",
      "parameters_sha256": "429e4c973a8a474fc428d84f6eba2f766d147f8f0c4a16b57031a66bf7d0f79f",
      "retries_used": 0,
      "classification": "success",
      "attempts": [
        {
          "attempt_index": 0,
          "model_id": "glm-5.2",
          "response_model_id": "glm-5.2",
          "http_status": 200,
          "assistant_action_valid": true,
          "classification": "success",
          "payload_sha256": "0000000000000000000000000000000000000000000000000000000000000006",
          "seed": 2334845458,
          "started_at": "2026-08-13T00:00:00Z",
          "finished_at": "2026-08-13T00:00:01Z",
          "duration_ms": 1000,
          "input_tokens": 4500,
          "output_tokens": 500,
          "provider_error_code": null
        }
      ]
    },
    {
      "request_index": 7,
      "phase": "repair",
      "model_id": "glm-5.2",
      "seed": 2334845458,
      "payload_sha256": "0000000000000000000000000000000000000000000000000000000000000007",
      "tool_schema_sha256": "ab95583632f93d80222f72716206db2d68016a777b13bdacf996f4d618154143",
      "parameters_sha256": "429e4c973a8a474fc428d84f6eba2f766d147f8f0c4a16b57031a66bf7d0f79f",
      "retries_used": 0,
      "classification": "success",
      "attempts": [
        {
          "attempt_index": 0,
          "model_id": "glm-5.2",
          "response_model_id": "glm-5.2",
          "http_status": 200,
          "assistant_action_valid": true,
          "classification": "success",
          "payload_sha256": "0000000000000000000000000000000000000000000000000000000000000007",
          "seed": 2334845458,
          "started_at": "2026-08-13T00:00:00Z",
          "finished_at": "2026-08-13T00:00:01Z",
          "duration_ms": 1000,
          "input_tokens": 4500,
          "output_tokens": 500,
          "provider_error_code": null
        }
      ]
    },
    {
      "request_index": 8,
      "phase": "repair",
      "model_id": "glm-5.2",
      "seed": 2334845458,
      "payload_sha256": "0000000000000000000000000000000000000000000000000000000000000008",
      "tool_schema_sha256": "ab95583632f93d80222f72716206db2d68016a777b13bdacf996f4d618154143",
      "parameters_sha256": "429e4c973a8a474fc428d84f6eba2f766d147f8f0c4a16b57031a66bf7d0f79f",
      "retries_used": 0,
      "classification": "success",
      "attempts": [
        {
          "attempt_index": 0,
          "model_id": "glm-5.2",
          "response_model_id": "glm-5.2",
          "http_status": 200,
          "assistant_action_valid": true,
          "classification": "success",
          "payload_sha256": "0000000000000000000000000000000000000000000000000000000000000008",
          "seed": 2334845458,
          "started_at": "2026-08-13T00:00:00Z",
          "finished_at": "2026-08-13T00:00:01Z",
          "duration_ms": 1000,
          "input_tokens": 4500,
          "output_tokens": 500,
          "provider_error_code": null
        }
      ]
    }
  ],
  "usage": {
    "model_requests": 8,
    "provider_attempts": 8,
    "tool_calls": 0,
    "total_tokens": 40000
  },
  "failure": {
    "class": null,
    "code": null
  },
  "result": {
    "candidate_scored": true,
    "structured_output_valid": true,
    "candidate_output_sha256": "e53142af0103df285526be3787a2cbcc7d35488bbfdabe68c74617e9eecd01fd",
    "raw_provider_response_stored": false
  },
  "evidence_observations": [],
  "tool_events": [],
  "reason_facts": {},
  "permission": {
    "trace_complete": true,